[
  {
    "id": 1763176549094,
    "date": "15/11/2025, 8:45:49 am",
    "dateOnly": "2025-11-15",
    "text": "A very comforting and peaceful day. Spent time organising things, watched a good movie, and mentally felt stable and clear. The day left me feeling light and happy.",
    "mood": "Vibing Day",
    "images": [],
    "audio": null,
    "confirmed": true
  },
  {
    "id": 1763087367475,
    "date": "14/11/2025, 7:59:27 am",
    "dateOnly": "2025-11-14",
    "text": "it was good day today",
    "mood": "Good Day",
    "images": [],
    "audio": null,
    "confirmed": true
  },
  {
    "id": 1763058000001,
    "date": "13/11/2025, 10:40:00 pm",
    "dateOnly": "2025-11-13",
    "text": "Today felt surprisingly refreshing. I completed most of my pending tasks, went for a short evening walk, and spent time listening to my favourite music. Overall, it felt like a light and balanced day.",
    "mood": "Vibing Day",
    "images": [],
    "audio": null,
    "confirmed": true
  },
  {
    "id": 1762971600002,
    "date": "12/11/2025, 9:10:00 pm",
    "dateOnly": "2025-11-12",
    "text": "Work went smoothly in the morning, and I managed to learn a couple of new things. Had a good conversation with a friend and cooked dinner on time. A genuinely good and productive day overall.",
    "mood": "Good Day",
    "images": [],
    "audio": null,
    "confirmed": true
  },
  {
    "id": 1762885200003,
    "date": "11/11/2025, 8:35:00 pm",
    "dateOnly": "2025-11-11",
    "text": "Felt a bit tired today, but nothing major. I finished some tasks slowly and took time to rest. The day was calm with no emotional highs or lows.",
    "mood": "Neutral",
    "images": [],
    "audio": null,
    "confirmed": true
  },
  {
    "id": 1762798800004,
    "date": "10/11/2025, 10:20:00 pm",
    "dateOnly": "2025-11-10",
    "text": "A mixed day. I had fun watching videos and chatting with a friend, but I also got overwhelmed by a few personal thoughts. Mood stayed balanced, leaning slightly towards positive.",
    "mood": "Vibing Day",
    "images": [],
    "audio": null,
    "confirmed": true
  },
  {
    "id": 1762712400005,
    "date": "09/11/2025, 9:50:00 pm",
    "dateOnly": "2025-11-09",
    "text": "Today felt truly uplifting. I woke up energetic, finished all my tasks before noon, and even helped a family member with some work. A very satisfying and fulfilling day.",
    "mood": "Great Day",
    "images": [],
    "audio": null,
    "confirmed": true
  },
  {
    "id": 1762626000006,
    "date": "08/11/2025, 8:15:00 pm",
    "dateOnly": "2025-11-08",
    "text": "The day had both good and unpleasant moments. I enjoyed some time gaming, but a small argument at home threw off the mood for a while. Eventually the evening improved.",
    "mood": "No Luck",
    "images": [],
    "audio": null,
    "confirmed": true
  },
  {
    "id": 1762539600007,
    "date": "07/11/2025, 11:05:00 pm",
    "dateOnly": "2025-11-07",
    "text": "A very comforting and peaceful day. Spent time organising things, watched a good movie, and mentally felt stable and clear. The day left me feeling light and happy.",
    "mood": "Good Day",
    "images": [],
    "audio": null,
    "confirmed": true
  },
  {
    "id": 1762453200008,
    "date": "06/11/2025, 10:10:00 pm",
    "dateOnly": "2025-11-06",
    "text": "The day didn\u00e2\u20ac\u2122t go as smoothly as I hoped. Faced a few disappointments and felt low for some hours. Still, I managed to end the day with a calmer mindset.",
    "mood": "Bad Day",
    "images": [],
    "audio": null,
    "confirmed": true
  }
]